{"schema":"rurix.g31.profile_output.v1","bin":"g31_window_present","scene":"bistro-interior","tier":100,"backend":"tsr_device","frames_measured":96,"warmup":2,"resolution":{"w":1920,"h":1080},"internal_resolution":{"w":1920,"h":1080},"headless":false,"render_digest":"sha256:b78d59d1d0c9fdec211cce3f21d68452e1e7912420a13d7b2e6c538a25a8c145","gpu_passes":[{"name":"g31_realism","unit":"gpu_timestamp_ms","mean_ms":6.096212,"p50_ms":6.006624,"p99_ms":6.354885,"min_ms":5.986912,"max_ms":6.579328},{"name":"g14_mv","unit":"gpu_timestamp_ms","mean_ms":0.031829,"p50_ms":0.031744,"p99_ms":0.033792,"min_ms":0.030720,"max_ms":0.033792},{"name":"g14_8_tsr_resample","unit":"gpu_timestamp_ms","mean_ms":0.131339,"p50_ms":0.131072,"p99_ms":0.134144,"min_ms":0.128000,"max_ms":0.134144},{"name":"g14_8_tsr_resolve","unit":"gpu_timestamp_ms","mean_ms":0.396715,"p50_ms":0.396288,"p99_ms":0.406528,"min_ms":0.387072,"max_ms":0.406528},{"name":"g31_bloom_bright","unit":"gpu_timestamp_ms","mean_ms":0.059029,"p50_ms":0.059392,"p99_ms":0.060416,"min_ms":0.057344,"max_ms":0.060416},{"name":"g31_bloom_blur_h","unit":"gpu_timestamp_ms","mean_ms":0.018517,"p50_ms":0.018432,"p99_ms":0.019456,"min_ms":0.017408,"max_ms":0.019456},{"name":"g31_bloom_blur_v","unit":"gpu_timestamp_ms","mean_ms":0.016213,"p50_ms":0.016384,"p99_ms":0.017408,"min_ms":0.015360,"max_ms":0.017408},{"name":"g31_bloom_composite","unit":"gpu_timestamp_ms","mean_ms":0.089365,"p50_ms":0.089088,"p99_ms":0.092211,"min_ms":0.088064,"max_ms":0.093184},{"name":"g31_autoexp_reduce","unit":"gpu_timestamp_ms","mean_ms":0.102293,"p50_ms":0.101376,"p99_ms":0.108544,"min_ms":0.099328,"max_ms":0.108544},{"name":"g31_autoexp_state","unit":"gpu_timestamp_ms","mean_ms":0.003520,"p50_ms":0.003072,"p99_ms":0.004096,"min_ms":0.003072,"max_ms":0.004096},{"name":"g31_display_encode","unit":"gpu_timestamp_ms","mean_ms":0.107893,"p50_ms":0.106496,"p99_ms":0.115712,"min_ms":0.106496,"max_ms":0.115712}],"cpu_segments":[{"name":"cpu_record","unit":"host_wall_ms","mean_ms":0.345932,"p50_ms":0.317150,"p99_ms":0.856640,"min_ms":0.205300,"max_ms":0.857400},{"name":"cpu_submit","unit":"host_wall_ms","mean_ms":0.061961,"p50_ms":0.057350,"p99_ms":0.147935,"min_ms":0.032600,"max_ms":0.184700},{"name":"cpu_fence_wait","unit":"host_wall_ms","mean_ms":8.067532,"p50_ms":8.041350,"p99_ms":8.680235,"min_ms":7.735100,"max_ms":9.414300},{"name":"readback_convert","unit":"host_wall_ms","mean_ms":0.040474,"p50_ms":0.000400,"p99_ms":0.193630,"min_ms":0.000200,"max_ms":3.844100}],"frame_segments":[{"name":"render_wall","unit":"host_wall_ms","mean_ms":9.995559,"p50_ms":9.784650,"p99_ms":13.636130,"min_ms":8.690000,"max_ms":16.840100},{"name":"present_wall","unit":"host_wall_ms","mean_ms":1.209264,"p50_ms":1.143050,"p99_ms":2.113890,"min_ms":0.938000,"max_ms":2.138400},{"name":"digest","unit":"host_wall_ms","mean_ms":2.281552,"p50_ms":0.000300,"p99_ms":20.442875,"min_ms":0.000100,"max_ms":94.855900}],"identity":{"gpu_sum_mean_ms":7.052926,"gpu_sum_p99_ms":7.311915,"render_wall_mean_ms":9.995559,"cpu_seg_sum_mean_ms":8.515900,"host_residual_mean_ms":1.479659,"host_residual_p99_ms":4.366995,"host_residual_min_ms":0.113300,"host_residual_max_ms":4.574000,"gpu_sum_le_render_wall_tol_ms":0.10,"host_residual_tol_ms":2.00,"rule":"gpu_sum_mean<=render_wall_mean+0.10 && -0.10<=host_residual_mean<=2.00"},"debug_labels":{"active":true,"annotated_pass_count":11,"extension":"VK_EXT_debug_utils","note":"vkCmdBegin/EndDebugUtilsLabelEXT 逐 pass 标注（pass 名）;扩展 absent = 零开销跳过 fail-silent"},"profiler_overhead":{"assembly_ms":0.070600,"note":"profiler 开销 = host 簿记（逐帧 Vec 推送）+ 本 JSON 组装段（assembly_ms 实测;写盘段在其后）;渲染语义零变更——digest 锚 on/off 位级一致由 ci/g31_profiling_smoke.py 门检"},"notes":"gpu_passes = DeviceFrameTelemetry 逐 pass GPU timestamp（声明序;×timestampPeriod 驱动实采）;cpu_segments = telemetry cpu_record/submit/fence_wait 三分项 + host readback_convert;frame_segments = host 墙钟（render_wall 含 BGRA8 8.3MB 强制回读税,present_wall headless 恒 0,digest 税单列不入渲染口径）;identity = 分解和≈帧墙钟恒等式（gpu_sum 为逐 pass GPU 合计,host_residual = render_wall − cpu 四段和;容差字段同 ci/g31_profiling_smoke.py）;默认关,开启零渲染语义变更"}
